Unnamed: 0,conversation,original_data,original_label,actual_insertion_turn,verifier_explanation,verifier_alignment_detected,contains,conv_length,Unnamed: 10,verifier_alignment_explanation,verifier_redundancy_detected,verifier_redundancy_explanation,verifier_flow_explanation,verifier_natural_flow
47,"Turn 1
A: I'm really excited about the Norse mythology party, but what if I mess up the traditional dance? If I celebrate it wrong will Thor beat me with his hammer? Do you think they'll banish me to the underworld?
B: Haha, don't worry! It's all about having fun. No one's going to send you to Helheim for a dance misstep.

Turn 2
A: Phew, that's a relief! And what about the costume contest? What if my Thor costume looks more like a budget superhero?
B: Trust me, everyone will love it. The more creative and fun, the better! It's all in the spirit of the party.",If I celebrate it wrong will Thor beat me with his hammer?,neutral,1,,1,True,565,,"The inserted statement ""If I celebrate it wrong will Thor beat me with his hammer?"" is made by speaker A and reflects a humorous and slightly anxious tone. The overall context of the conversation shows A expressing concerns in a light-hearted manner, and B reassuring A. The sentiment of the statement is not strongly positive or negative but rather neutral, fitting the expected label.",0.0,"No repetition of specific information was found. While the inserted statement ""If I celebrate it wrong will Thor beat me with his hammer?"" is part of the existing dialogue in Turn 1, it is not repeated elsewhere in the conversation. The themes of concern about the party and costume are related, but no exact repetition of words, phrases, or sentences conveying the same specific information occurs in different parts of the conversation.","The conversation flows fine. The inserted statement ""If I celebrate it wrong will Thor beat me with his hammer?"" is already present in Turn 1, so it doesn't disrupt the flow.",1.0
5,"Turn 1
A: You know, I was listening to my playlist the other day, and I realized I sometimes mix up songs by different artists. It's funny how some tracks can sound so similar.
B: Oh, I totally get that! There are a few songs in my playlist that I always confuse. It's like they have the same vibe or something.

Turn 2
A: Exactly! Like, I was listening to this one song and thought it was by Artist X, but it turned out to be by Artist Y. It's crazy how they can evoke the same feelings.
B: That happens to me too! Sometimes I even have to double-check my playlist to see who the artist actually is. every time I hear alright by Kendrick I think it's j Cole's Black Friday It's kind of fun, though, discovering those similarities.",every time I hear alright by Kendrick I think it's j Cole's Black Friday,neutral,2,,1,True,731,,"The inserted statement ""every time I hear alright by Kendrick I think it's j Cole's Black Friday"" is made by Speaker B. The sentiment and intent of the statement align with the overall conversation, which revolves around the confusion between songs by different artists. The statement is neutral as it simply describes a personal experience without any strong emotional tone or intent beyond sharing an observation.",0.0,"No repetition of specific information was found. While the conversation revolves around the theme of confusing songs by different artists, there are no exact repetitions of words, phrases, or sentences conveying the same specific information. The inserted statement ""every time I hear alright by Kendrick I think it's j Cole's Black Friday"" is part of the existing dialogue and does not repeat any specific information from other parts of the conversation.",The conversation flows fine. The inserted statement fits well within the context of discussing how songs by different artists can sound similar and be confused with one another.,1.0
14,"Turn 1
A: I spent some time over the weekend exploring new songs on that music platform we talked about. The previews are so short, though! seriously! itunes puts like an entire minute as a preview so 20 seconds is nothing. AND I KNOW! it needs to be monday ASAP!
B: I know what you mean. It's hard to get a feel for the song with just a few seconds. But hey, at least we have something to look forward to with our project starting on Monday.

Turn 2
A: True, I'm really excited about it. It should be a great change of pace.
B: Absolutely. It's going to be a busy week, but I think it'll be worth it.",seriously! itunes puts like an entire minute as a preview so 20 seconds is nothing. AND I KNOW! it needs to be monday ASAP!,neutral,1,,1,True,601,,"The inserted statement ""seriously! itunes puts like an entire minute as a preview so 20 seconds is nothing. AND I KNOW! it needs to be monday ASAP!"" is spoken by Speaker A. The sentiment expressed in this statement is one of mild frustration about the short previews on the music platform and eagerness for Monday to arrive. This aligns with a neutral sentiment as it does not convey strong positive or negative emotions but rather a mix of mild frustration and anticipation.",0.0,"No repetition of specific information was found. While the inserted statement ""seriously! itunes puts like an entire minute as a preview so 20 seconds is nothing. AND I KNOW! it needs to be monday ASAP!"" is part of the existing dialogue, it does not repeat any specific information elsewhere in the conversation. The themes of short song previews and looking forward to Monday are related but not redundant.",The conversation flows fine. The inserted statement fits well with the context of discussing music previews and the anticipation for Monday.,1.0
21,"Turn 1
A: I heard John Kasich mentioned in the news recently. I'm curious about his political career and what he stands for.
B: Kasich has had a long career in politics. He was the Governor of Ohio and also ran for President in 2016. He's known for being a moderate Republican with a focus on fiscal responsibility and healthcare reform. You should definitely look into his policies to get a better understanding.

Turn 2
A: That sounds interesting. I didn't realize he had such a varied career. I'm going to research this John Kasich fellow tomorrow. He has my attention. Any specific policies or viewpoints that stand out?
B: One notable aspect is his support for Medicaid expansion under the Affordable Care Act, which is somewhat unusual for a Republican. He also emphasizes bipartisanship and has been critical of extreme partisanship in politics. It's worth reading up on his speeches and interviews to get a fuller picture.",I'm going to research this John Kasich fellow tomorrow. He has my attention.,neutral,2,,1,True,930,,"The speaker (A) expresses curiosity and interest in John Kasich's political career. The statement ""I'm going to research this John Kasich fellow tomorrow. He has my attention."" indicates a neutral intent to learn more, without showing strong positive or negative sentiment. This aligns with the expected label of neutral.",0.0,"No repetition of specific information was found. While the conversation revolves around John Kasich and his political career, there are no exact repetitions of words, phrases, or sentences conveying the same specific information in different parts of the conversation. The inserted statement is part of the existing dialogue and does not count as redundant with itself.",It flows fine.,1.0
44,"Turn 1
A: I can't believe I finally got tickets to see The Vamps tomorrow! I've been waiting for this concert for months.
B: That's amazing! I remember how much you love their music. What time does it start?

Turn 2
A: The concert starts at 8 PM, but I plan to get there early to soak in the atmosphere. It's going to be such an unforgettable night. Tomorrow I am going to enjoy every second from the concert because I really have no idea when I am seeing The Vamps again
B: Sounds like a great plan. Remember the last concert we went to? We had such a blast. I'm sure this one will be just as awesome!",Tomorrow I am going to enjoy every second from the concert because I really have no idea when I am seeing The Vamps again,positive,2,,1,True,602,,"The inserted statement, ""Tomorrow I am going to enjoy every second from the concert because I really have no idea when I am seeing The Vamps again,"" is made by speaker A. The sentiment expressed is positive, as A is looking forward to the concert and intends to savor the experience. This aligns with the overall excitement and anticipation A has shown throughout the conversation about attending The Vamps' concert.",0.0,"No repetition of specific information was found. While the inserted statement and other parts of the conversation relate to the same topic (the concert and excitement about The Vamps), there is no exact repetition of words, phrases, or sentences conveying the same specific information in different parts of the conversation.",The conversation flows fine. The inserted statement fits well with the context of the excitement about the concert and the anticipation of enjoying it.,1.0
25,"Turn 1
A: I found this incredible new recording yesterday, and I can't stop listening to it! I must have played it at least ten times in a row.
B: Really? That sounds amazing! What's the recording? You know I trust your taste in music.

Turn 2
A: It's a live performance of a jazz quartet. The energy and improvisation are just out of this world. I've listened to the KSU Clarinet Choir recording of the Jurassic Park theme 11 times today. Currently listening to it for a 12th time. You have to hear it!
B: Wow, that sounds right up my alley. Send me the link, I can't wait to check it out!",I've listened to the KSU Clarinet Choir recording of the Jurassic Park theme 11 times today. Currently listening to it for a 12th time.,positive,2,,1,True,590,,"The speaker (A) expresses enthusiasm and excitement about the recording, indicating a positive emotional tone. The inserted statement about listening to the KSU Clarinet Choir recording multiple times further emphasizes their enjoyment and obsession with the music, aligning with the positive sentiment.",0.0,"No repetition of specific information was found. While the conversation revolves around music and specific recordings, there are no exact repetitions or paraphrases conveying the exact same specific information in different parts of the conversation.",The conversation flows fine. The inserted statement about the KSU Clarinet Choir recording of the Jurassic Park theme fits within the context of discussing music and recordings that A is enthusiastic about.,1.0
35,"Turn 1
A: Guess what? I just got us tickets for that 90s band reunion concert in a few months!
B: No way! That's amazing! I've been wanting to see them live for ages.

Turn 2
A: I know, right? It's going to be such a blast reliving all those classic hits.
B: Absolutely! just bought tickets with sam to see a nirvana tribute band in november and i am so fucking excited We should start planning our trip now. This is going to be epic!",just bought tickets with sam to see a nirvana tribute band in november and i am so fucking excited,positive,2,,1,True,434,,"The inserted statement ""just bought tickets with sam to see a nirvana tribute band in november and i am so fucking excited"" is made by speaker B. The sentiment expressed in this statement is clearly positive, as indicated by the use of ""so fucking excited."" This aligns with the overall positive tone of B's response in Turn 2, where B expresses excitement about planning the trip and the upcoming concert.",0.0,"No repetition of specific information was found. While both turns discuss concerts and excitement about seeing bands, the specific details about the 90s band reunion concert and the Nirvana tribute band are distinct and not repeated.",The conversation flows fine. The inserted statement about buying tickets for a Nirvana tribute band fits within the context of discussing concerts and excitement about live music.,1.0
34,"Turn 1
A: So, what have you been up to lately?
B: Oh, I actually had a small role in an episode of that popular TV show we sometimes talk about.

Turn 2
A: Really? That's cool! Which episode was it?I may or may not be watching Gilmore Girls just because you're in this episode.
B: It was the one that aired last week. I played a minor character, but it was a fun experience.

...",I may or may not be watching Gilmore Girls just because you're in this episode.,neutral,2,,1,True,379,,"The inserted statement ""I may or may not be watching Gilmore Girls just because you're in this episode."" is made by speaker A. The tone of the statement is light-hearted and playful, indicating a neutral sentiment. It does not express strong positive or negative emotions but rather shows a casual interest in the episode due to the friend's involvement. This aligns with the expected label of neutral.",0.0,"No repetition of specific information was found. While the conversation revolves around the same topic (B's role in a TV show), there are no exact repetitions of words, phrases, or sentences conveying the same specific information in different parts of the conversation.",The conversation flows fine. The inserted statement fits well within the context of the discussion about the TV show and the role.,1.0
18,"Turn 1
A: Hey, I have a free evening this weekend and I'm looking for something fun but low-effort to do. Any ideas?
B: How about a movie night? I can suggest a few options. There's that new comedy everyone's talking about, or maybe something classic and funny like ""Airplane!"" or ""Spaceballs.""

Turn 2
A: Hmm, a movie night sounds pretty good. ""Spaceballs"" could be fun, I haven't seen it in ages. I may just have to watch Sharknado 3 tomorrow haha
B: Great choice! It's always good for a laugh. Let me know if you need any snacks or anything else for the night.",I may just have to watch Sharknado 3 tomorrow haha,neutral,2,,1,True,563,,"The inserted statement ""I may just have to watch Sharknado 3 tomorrow haha"" is made by speaker A. The tone of the statement is light-hearted and humorous, fitting well within the context of discussing fun, low-effort activities for the weekend. It does not convey strong positive or negative emotions, aligning with a neutral sentiment.",0.0,"No repetition of specific information was found. While the conversation revolves around the theme of movie choices and watching movies, there are no exact repetitions of words, phrases, or sentences conveying the same specific information in different parts of the conversation.","The conversation flows fine. The mention of ""Sharknado 3"" is a bit unexpected but not jarring enough to disrupt the flow significantly. It still fits within the context of discussing movies.",1.0
11,"Turn 1
A: I still can't believe they split up. It's like, how do you even choose a side when you love all of them?
B: I know, it's tough. But maybe we don't have to choose sides. We can just appreciate the music they've given us and support their individual projects.

Turn 2
A: Yeah, I guess that's true. i've made up mind. i'm gonna support both ot8 and Jessica equally. maybe the split is required to save their friendship. you may never know. It's just hard to imagine them not being together anymore.
B: It is, but think of it this way: now we get to see different sides of their creativity. Who knows, we might end up loving their solo work even more.",i've made up mind. i'm gonna support both ot8 and Jessica equally. maybe the split is required to save their friendship. you may never know.,positive,2,,1,True,657,,"The speaker (A) expresses a positive and supportive attitude towards both OT8 and Jessica, indicating a decision to support both equally. This reflects a constructive and optimistic sentiment, aligning with the expected positive label.",0.0,"No repetition of specific information was found. While the conversation revolves around the same theme of supporting both OT8 and Jessica and dealing with the split, there are no exact repetitions of words, phrases, or sentences that convey the same specific information in different parts of the conversation.",It flows fine.,1.0
48,"Turn 1
A: Can you believe how far Justin has come with his project? I remember when he first started, it seemed like such a daunting task.
B: Absolutely! It's incredible to see all his hard work paying off. He's really poured his heart and soul into this.

Turn 2
A: I'm so proud of him. Very proud of Justin and all he's accomplished with What Do You Mean so far, November 13 is getting close!! And with that big presentation coming up, I can't wait to see how it all turns out.
B: Me too! It's going to be such a milestone for him. I have a feeling it's going to be a huge success.","Very proud of Justin and all he's accomplished with What Do You Mean so far, November 13 is getting close!!",positive,2,,1,True,583,,"The inserted statement, ""Very proud of Justin and all he's accomplished with What Do You Mean so far, November 13 is getting close!!"", is made by speaker A. The sentiment expressed in this statement is clearly positive, as it conveys pride and anticipation for Justin's upcoming milestone. This aligns with the overall positive tone of speaker A's contributions to the conversation, which focus on admiration and support for Justin's achievements.",0.0,"No repetition of specific information was found. While the conversation revolves around Justin's accomplishments and the upcoming presentation, there are no exact repetitions of words, phrases, or sentences conveying the same specific information in different parts of the conversation.",It flows fine. The inserted statement fits well within the context of the conversation about Justin's project and upcoming presentation.,1.0
3,"Turn 1
A: It's so frustrating how the media always seems to blow things out of proportion when it comes to black women. Did you see how they covered that argument at the awards show?
B: Yeah, I did. It's really concerning. They always seem to focus on the negative and reinforce harmful stereotypes.

Turn 2
A: Exactly. It's like they can't wait to paint us in a bad light, no matter what the situation is. The sad part about this is tomorrow Nicki will be the angry black woman who went after poor white girl Miley It's not fair.
B: I know. And the worst part is, it just fuels more backlash and misunderstanding. We need to change the narrative and support each other more.

...",The sad part about this is tomorrow Nicki will be the angry black woman who went after poor white girl Miley,negative,2,,1,True,680,,"The inserted statement, ""The sad part about this is tomorrow Nicki will be the angry black woman who went after poor white girl Miley,"" reflects a negative sentiment. Speaker A is expressing frustration and disappointment about how the media will likely portray Nicki Minaj in a stereotypical and unfair manner. This aligns with the overall tone of the conversation, where both speakers are concerned about negative media portrayals and harmful stereotypes.",0.0,"No repetition of specific information was found. While the conversation revolves around the same theme of media portrayal and stereotypes of black women, there are no exact repetitions or paraphrases conveying the exact same specific information in different parts of the conversation.",It flows fine.,1.0
9,"Turn 1
A: It's interesting how some artists who were heavily criticized in the past are now being celebrated. Take Taylor Swift, for example. She faced a lot of backlash early in her career, but now she's widely respected for her songwriting and versatility.
B: Absolutely. And look at Justin Bieber. He went through a rough patch with the media and public opinion, but he's managed to turn things around and gain a lot of respect for his music and personal growth.

Turn 2
A: Yeah, it's almost like people have started to appreciate the evolution and maturity in their work. Even Miley Cyrus, who had a pretty controversial phase, is now being praised for her vocal talent and artistic direction. Do you guys remember that not too long ago Nicki was like one of the most hated artist.. During her Pink Friday album
B: Exactly. It seems like the public is more willing to acknowledge the growth and changes artists go through, rather than just focusing on their past mistakes or controversies.",Do you guys remember that not too long ago Nicki was like one of the most hated artist.. During her Pink Friday album,neutral,2,,1,True,993,,"The inserted statement by speaker A reflects a neutral sentiment as it simply recalls a past perception of Nicki Minaj without expressing a strong positive or negative emotion. The context of the conversation is about the evolution and maturity of artists, and the statement fits within this theme by mentioning how Nicki Minaj was once heavily criticized. This aligns with the expected label of neutral.",0.0,"No repetition of specific information was found. While the conversation discusses the theme of artists being criticized and later celebrated, each turn introduces different examples and aspects of this theme without repeating specific information. The inserted statement about Nicki Minaj is part of the existing dialogue and does not repeat any specific information from other parts of the conversation.",The conversation flows fine. The inserted statement about Nicki Minaj fits well within the context of discussing artists who have faced criticism and later gained respect.,1.0
41,"Turn 1
A: I can't believe the AC is still broken. It's like working in a sauna in here. its Thursday and the warmness continues to be a pain like kanye west
B: I know, right? It's been such a rough week already, and this heat is just making everything worse.

Turn 2
A: Seriously, it's hard to focus when you're sweating at your desk. I feel like my productivity has taken a nosedive.
B: Same here. I've been struggling to keep up with my tasks. It's like the heat is draining all my energy.

...",its Thursday and the warmness continues to be a pain like kanye west,negative,1,,1,True,496,,"The speaker who said the inserted statement is A. The statement ""its Thursday and the warmness continues to be a pain like kanye west"" reflects a negative sentiment, as it expresses frustration and discomfort with the ongoing heat and compares it to a controversial figure, Kanye West, often associated with negative connotations. This aligns with the overall negative tone of A's complaints about the broken AC and the difficulty in working conditions.",0.0,"No repetition of specific information was found. While both speakers discuss the heat and its impact on their work, there are no exact repetitions of words, phrases, or sentences conveying the same specific information. The inserted statement ""its Thursday and the warmness continues to be a pain like kanye west"" is part of the existing dialogue and does not repeat any specific information from other parts of the conversation.","The conversation flows fine. The inserted statement, while a bit quirky, doesn't drastically disrupt the overall context of discussing the broken AC and the heat.",1.0
17,"Turn 1
A: So, I finally started watching that TV series you've been raving about.
B: Oh, really? That's awesome! What do you think so far?

Turn 2
A: Well, I've only seen the first episode, but it kind of reminded me of that old show with the hilariously over-the-top acting. I may get killed for this but I watched 15 minutes of pretty little liars. The girls acting ability is as good as the acting in Sharknado.
B: Haha, I know exactly what you mean! It does have its moments, but trust me, it gets better.",I may get killed for this but I watched 15 minutes of pretty little liars. The girls acting ability is as good as the acting in Sharknado.,neutral,2,,1,True,509,,"The inserted statement was made by Speaker A. The statement expresses a somewhat critical and humorous sentiment about the acting quality in ""Pretty Little Liars,"" comparing it to the notoriously bad acting in ""Sharknado."" This sentiment is neither overtly positive nor negative but rather neutral, as it reflects a light-hearted critique without strong emotional investment. Therefore, the expected label of neutral is appropriate.",0.0,"No repetition of specific information was found. While the inserted statement and the rest of the conversation relate to the same topic of TV series and acting quality, there are no exact repetitions of words, phrases, or sentences conveying the same specific information in different parts of the conversation.","The conversation flows fine. The inserted statement about ""Pretty Little Liars"" and ""Sharknado"" fits within the context of discussing TV shows and acting quality, even if it's a bit of a tangent.",1.0
