Unnamed: 0,conversation,original_data,original_label,actual_insertion_turn,verifier_explanation,verifier_alignment_detected,contains,conv_length,Unnamed: 10,verifier_alignment_explanation,verifier_redundancy_detected,verifier_redundancy_explanation,verifier_flow_explanation,verifier_natural_flow
43,"Turn 1
A: I've been diving into a lot of different music genres lately. It's been quite an adventure.
B: That's awesome! Are you still into that genre you were so passionate about before?

Turn 2
A: Not as much, actually. looks like I'm done with Kpop guys I've found myself gravitating towards some new sounds that I never thought I'd enjoy.
B: Interesting! What kind of music are you into now?

...",looks like I'm done with Kpop guys,neutral,2,,1,True,400,,"The inserted statement ""looks like I'm done with Kpop guys"" by speaker A reflects a neutral sentiment. A is simply stating a shift in their music preferences without expressing any strong positive or negative emotions. The context of the conversation supports this as A mentions gravitating towards new sounds, indicating a change rather than an emotional reaction.",0.0,"No repetition of specific information was found. While the conversation touches on the theme of changing music preferences, there are no exact repetitions or paraphrases conveying the same specific information in different parts of the conversation.","The conversation flows fine. The inserted statement ""looks like I'm done with Kpop guys"" fits naturally within the context of A explaining their shift in music preferences.",1.0
2,"Turn 1
A: You know that show you recommended to me? I started watching it last night.
B: Oh, great! What did you think of the first episode?

Turn 2
A: Honestly, I found it really unsettling. The themes were just too dark for me, and I couldn't get past the first episode. Did you watch the 1st episode of American Horror Story yet so you can understand why I refuse to watch the rest of it ?!?!?
B: Wow, I didn't expect that. What specifically bothered you about it?",Did you watch the 1st episode of American Horror Story yet so you can understand why I refuse to watch the rest of it ?!?!?,negative,2,,1,True,467,,"The inserted statement was made by Speaker A. The tone of the statement is one of frustration and disappointment, as Speaker A is expressing a strong negative reaction to the show ""American Horror Story."" The use of multiple question marks and exclamation points further emphasizes the intensity of their negative sentiment. This aligns with the expected label of ""negative.""",0.0,"No repetition of specific information was found. While the inserted statement ""Did you watch the 1st episode of American Horror Story yet so you can understand why I refuse to watch the rest of it ?!?!?"" is part of the existing dialogue, it does not repeat any specific information from other parts of the conversation. The themes and topics are related, but there is no exact repetition of words, phrases, or sentences conveying the same specific information.","The conversation flows fine. The inserted statement about ""American Horror Story"" fits within the context of discussing unsettling themes in a show.",1.0
5,"Turn 1
A: I just bought a ticket for the concert, and I splurged on a better seat to get an awesome view!
B: That sounds amazing! I've been thinking about going too. Which section did you get?

Turn 2
A: I got a seat in the front section, close to the stage. It's going to be epic! Are you planning to get a ticket as well?
B: I'm definitely tempted now. tickets are 60 or 114 but I'm getting the 114 oneeeee lol I just need to know who down frfr. December 5 at oracle Let me check with a couple of our friends and see if they're interested too. It would be fun to go together!",tickets are 60 or 114 but I'm getting the 114 oneeeee lol I just need to know who down frfr. December 5 at oracle,positive,2,,1,True,577,,"The inserted statement was made by Speaker B. The statement ""tickets are 60 or 114 but I'm getting the 114 oneeeee lol I just need to know who down frfr. December 5 at oracle"" reflects excitement and enthusiasm about purchasing the more expensive ticket and the potential of attending the concert with friends. This aligns with a positive sentiment, as Speaker B is expressing eagerness and a proactive attitude towards making plans for the event.",0.0,"No repetition of specific information was found. While the inserted statement ""tickets are 60 or 114 but I'm getting the 114 oneeeee lol I just need to know who down frfr. December 5 at oracle"" provides detailed information about ticket prices and the event date, this information is not repeated elsewhere in the conversation. The rest of the dialogue discusses the concert and the excitement about attending, but does not repeat the specific details about ticket prices or the event date.",The conversation flows fine. The inserted statement about ticket prices and the date/location of the concert fits naturally into the context of discussing concert plans and ticket purchases.,1.0
15,"Turn 1
A: Hey B, have you noticed that there's barely any Kpop chatter on social media tonight? It's so weird, especially after that big release yesterday.Why is my TL so dead um is it Kpop is dead Friday or something???
B: Yeah, I saw that too. I was expecting a lot more buzz. Maybe everyone's just busy with something else tonight?

Turn 2
A: Maybe, but it's still strange. Usually, our feed is flooded with reactions and fan theories by now.
B: True. Let's give it some time. Maybe people will start posting later. Or we could start a discussion ourselves and see if it picks up?",Why is my TL so dead um is it Kpop is dead Friday or something???,negative,1,,1,True,583,,"The inserted statement ""Why is my TL so dead um is it Kpop is dead Friday or something???"" is made by speaker A. The tone of the statement reflects confusion and mild frustration about the lack of Kpop chatter on social media. This sentiment aligns with a negative label, as A is expressing disappointment and bewilderment over the unexpected silence.",0.0,"No repetition of specific information was found. While the conversation revolves around the same topic of the lack of Kpop chatter on social media, there are no exact repetitions of words, phrases, or sentences conveying the same specific information in different parts of the conversation.",The conversation flows fine. The inserted statement fits well with the context of the discussion about the lack of Kpop chatter on social media.,1.0
12,"Turn 1
A: Good morning...back after a couple of days off for Labor Day weekend. So today is my Monday. I make no promises. Ready with Morning, B! It's always tough getting back into the groove after a long weekend. I feel like I need a vacation to recover from my vacation!
B: Haha, I know the feeling! So, what did you get up to? Anything exciting?

Turn 2
A: Oh, it was great! We went hiking, had a barbecue, and I even managed to finish that book I've been putting off. How about you? How was your weekend?
B: Sounds fantastic! Mine was pretty low-key, just caught up on some sleep and watched a few movies. Sometimes, that's all you need, right?",Good morning...back after a couple of days off for Labor Day weekend. So today is my Monday. I make no promises. Ready with,positive,1,,1,True,649,,"The inserted statement is made by speaker A and reflects a light-hearted, humorous tone about returning to work after a long weekend. The phrase ""I make no promises"" suggests a playful acknowledgment of the difficulty in getting back into the work routine, which aligns with a positive sentiment. The overall context of the conversation is friendly and casual, supporting the expected label.",0.0,"No repetition of specific information was found. While the inserted statement is part of the existing dialogue, it is not considered redundant with itself. The conversation does not contain any exact repetitions of words, phrases, or sentences that occur in different parts, nor does it contain paraphrases that convey the exact same specific information in different turns or by different speakers.",The conversation flows fine. The inserted statement fits well with the context of returning from a long weekend and discussing how it feels like a Monday.,1.0
